{
  "id": "synthetic-random-baseline",
  "name": "Synthetic Random Baseline Adapter",
  "mode": "diagnostic",
  "asset_classes": ["synthetic"],
  "owner": "the-pass",
  "providers": [
    {
      "id": "synthetic-random-fixture",
      "type": "synthetic",
      "license": "public-safe",
      "fields": ["timestamp", "close", "random_signal", "gross_return", "cost", "net_return"],
      "limitations": ["Deterministic fixture", "No real market microstructure", "No tradable edge"]
    }
  ],
  "engine": {
    "name": "none",
    "role": "fixture-only",
    "limitations": ["No execution engine"]
  },
  "policies": {
    "timestamp": "Single synthetic timestamp; no receive-time latency model",
    "cost_model": "Illustrative fixed drag per signal",
    "fill_model": "No fills; diagnostic package only",
    "risk_model": "No capital at risk",
    "settlement": "Not applicable"
  },
  "safety": {
    "live_trading_enabled": false,
    "real_order_path_available": false,
    "credentials_required": false
  }
}
